<?xml version="1.0" encoding="UTF-8"?>
<!DOCTYPE xml>
<Corporations
	xmlns:xsi="http://www.w3.org/2001/XMLSchema-instance"
	xsi:schemaLocation="https://krazick.github.io/schema 
						https://krazick.github.io/18XX-Game-Engine-XML/public/XSD/18XX-Corporations.xsd">
	<Private id="1001" name="Schuylkill Valley" abbrev="SVN&amp;RR" cost="20" 
		note="No other attributes"
		revenue="5" homeCell1="G15" homeLocation1="10" homeLocation2="15" special="NONE" mustSell="true">
		<Certificate director="YES" percentage="100"
			allowedOwners="IPO,Player,Share" />
	</Private>
	<Private id="1002" name="Champlain &amp; St. Lawrence" abbrev="C&amp;SL" cost="40" 
		revenue="10" homeCell1="B20" homeLocation1="7" homeLocation2="12" 
		note="A Corporation owning the C&amp;SL may lay a tile on the C&amp;SL's hex even if this hex is not connected to the Corporation's Railhead. This free tile placement is in addition to the Corporation's tile placement — For this turn only the Corporation may play two tiles. The tile played on the C&amp;SL hex does not have to connect to any existing adjacent track."
		special="Free Tile Placement">
		<Benefits>
			<Benefit actorType="Share Company" class="ge18xx.company.benefit.TilePlacementBenefit" extra="true" mapCell="B20" cost="0" passive="false"/>
		</Benefits>
		<Certificate director="YES" percentage="100"
			allowedOwners="IPO,Player,Share" />
	</Private>
	<Private id="1003" name="Delaware &amp; Hudson" abbrev="D&amp;H"
		cost="70" revenue="15" homeCell1="F16" homeLocation1="16" homeLocation2="14" 
		note="A Corporation owning the D&amp;H may establish a Railhead on the D&amp;H’s hex by laying a station tile and a token. The station does NOT have to be connected to the remainder of the Corporation’s route. The tile layed is the owning Railroad’s one tile placement per turn. Placing a token is not required, but if placed in a future turn, it must be paid for. Removal of the mountain costs $120 as usual but there is no charge for laying the token.  (Other Corporations may lay a tile here subject to the  ordinary rules.)"
		special="Tile Placement and Token Placement">
		<Benefits>
			<Benefit actorType="Share Company" class="ge18xx.company.benefit.TilePlacementBenefit" extra="false" mapCell="F16" cost="120" passive="false"/>
			<Benefit actorType="Share Company" class="ge18xx.company.benefit.TokenPlacementBenefit" closeOnUse="false" extra="false" mapCell="F16" cost="0" sameTurn="true" passive="false"/>
		</Benefits>
		<Certificate director="YES" percentage="100"
			allowedOwners="IPO,Player,Share" />
	</Private>
	<Private id="1004" name="Mohawk &amp; Hudson" abbrev="M&amp;H"
		cost="110" revenue="20" homeCell1="D18" homeLocation1="21" homeLocation2="44"
		note="A player owning the M&amp;H may exchange it for a 10% share of NYC provided the player does not already hold 60% of the NYC stock and there is NYC stock available in the Bank or the Pool. The exchange may be made during the player’s turn of a Stock Round or between the turns of other players or Railroads in either Stock or Operating Rounds.  This action closes the M&amp;H." 
		special="Exchange for 10% of NYC">
		<Benefits>
			<Benefit actorType="Player" class="ge18xx.company.benefit.QueryExchangeBenefit" corporationID="1103" certificatePercentage="10" closeOnUse="true" passive="false"/>
		</Benefits>
		<Certificate director="YES" percentage="100"
			allowedOwners="IPO,Player,Share" />
	</Private>
	<Private id="1005" name="Camden &amp; Amboy" abbrev="C&amp;A"
		cost="160" revenue="25" homeCell1="H18" homeLocation1="15" homeLocation2="45" 
		note="The initial purchaser of the C&amp;A immediately receives a 10% share of PRR stock without further payment. This action does NOT close the C&amp;A. The PRR Corporation will not be running at this point, but the stock may be retained or sold subject to the ordinary rules of the game (see  8.1, last paragraph)."
		special="Free 10% PRR">
		<Benefits>
			<Benefit actorType="Player" class="ge18xx.company.benefit.FreeCertificateBenefit" corporationID="1101" certificatePercentage="10" passive="true"/>
		</Benefits>
		<Certificate director="YES" percentage="100"
			allowedOwners="IPO,Player,Share" />
	</Private>
	<Private id="1006" name="Baltimore &amp; Ohio" abbrev="B&amp;O"
		cost="220" revenue="30" homeCell1="I15" homeLocation1="12" homeLocation2="13" 
		note="The owner of the B&amp;O Private Company immediately receives the President’s Certificate of the B&amp;O Railroad without further payment (see 8.1). The B&amp;O Private Company may NOT be sold to any Corporation, and does not change hands if the owning player loses the Presidency of the  B&amp;O. When the B&amp;O Corporation purchases its first train the Private Company is closed down."
		special="Free President Share of B&amp;O">
		<Benefits>
			<Benefit actorType="Player" class="ge18xx.company.benefit.FreeCertificateBenefit" corporationID="1102" certificatePercentage="20" certificatePresident="true" passive="true"/>
		</Benefits>
		<Certificate director="YES" percentage="100"
			allowedOwners="IPO,Player" />
	</Private>
	<Share id="1101" name="Pennsylvania" abbrev="PRR" homeCell1="H12"
		homeLocation1="14" bgColor="Dark Green" fgColor="White" tokens="4" tokenType="FixedCost">
		<Certificate director="YES" percentage="20" allowedOwners="IPO,Player" />
		<Certificate director="NO" percentage="10" quantity="8"
			allowedOwners="IPO,Player,BankPool" />
	</Share>
	<Share id="1102" name="Baltimore &amp; Ohio" abbrev="B&amp;O"
		homeCell1="I15" homeLocation1="21" bgColor="Deep Blue" fgColor="White"
		tokens="3"  tokenType="FixedCost" closeOnTrainPurchase="1006">
		<Certificate director="YES" percentage="20" allowedOwners="IPO,Player" />
		<Certificate director="NO" percentage="10" quantity="8"
			allowedOwners="IPO,Player,BankPool" />
	</Share>
	<Share id="1103" name="New York Central" abbrev="NYC" homeCell1="E19"
		homeLocation1="50" bgColor="Black" fgColor="White" tokens="4" tokenType="FixedCost">
		<Certificate director="YES" percentage="20" allowedOwners="IPO,Player" />
		<Certificate director="NO" percentage="10" quantity="8"
			allowedOwners="IPO,Player,BankPool" />
	</Share>
	<Share id="1104" name="Chesapeake &amp; Ohio" abbrev="C&amp;O"
		homeCell1="F6" homeLocation1="17" bgColor="turquoise" fgColor="Black"
		tokens="3" tokenType="FixedCost">
		<Certificate director="YES" percentage="20" allowedOwners="IPO,Player" />
		<Certificate director="NO" percentage="10" quantity="8"
			allowedOwners="IPO,Player,BankPool" />
	</Share>
	<Share id="1105" name="New York, New Haven &amp; Hartford"
		abbrev="NYNH" homeCell1="G19" homeLocation1="8" bgColor="Orange"
		fgColor="Black" tokens="2" tokenType="FixedCost">
		<Certificate director="YES" percentage="20" allowedOwners="IPO,Player" />
		<Certificate director="NO" percentage="10" quantity="8"
			allowedOwners="IPO,Player,BankPool" />
	</Share>
	<Share id="1106" name="Boston &amp; Maine" abbrev="B&amp;M"
		homeCell1="E23" homeLocation1="21" mustBuyTrain="true" 
		bgColor="Light Green" fgColor="Black" homeColor="Black" tokens="2" tokenType="FixedCost">
		<Certificate director="YES" percentage="20" allowedOwners="IPO,Player" />
		<Certificate director="NO" percentage="10" quantity="8"
			allowedOwners="IPO,Player,BankPool" />
	</Share>
	<Share id="1107" name="Canadian Pacific" abbrev="CP" homeCell1="A19"
		homeLocation1="17" bgColor="Red" fgColor="White" tokens="4" tokenType="FixedCost">
		<Certificate director="YES" percentage="20" allowedOwners="IPO,Player" />
		<Certificate director="NO" percentage="10" quantity="8"
			allowedOwners="IPO,Player,BankPool" />
	</Share>
	<Share id="1108" name="Erie" abbrev="Erie" homeCell1="E11"
		homeLocation1="17" homeLocation2="15" bgColor="Gold" fgColor="Black"
		homeColor="Black" tokens="3" tokenType="FixedCost">
		<Certificate director="YES" percentage="20" allowedOwners="IPO,Player" />
		<Certificate director="NO" percentage="10" quantity="8"
			allowedOwners="IPO,Player,BankPool" />
	</Share>
	<StartPacket>
		<Item row="1">
			<Certificate available="true" corporationId="1001" discountAmount="5" canBeBidOn="NO"></Certificate>
		</Item>
		<Item row="2">
			<Certificate available="true" corporationId="1002" discountAmount="0" canBeBidOn="YES"></Certificate>
		</Item>
		<Item row="3">
			<Certificate available="true" corporationId="1003" discountAmount="0" canBeBidOn="YES"></Certificate>
		</Item>
		<Item row="4">
			<Certificate available="true" corporationId="1004" discountAmount="0" canBeBidOn="YES"></Certificate>
		</Item>
		<Item row="5">
			<Certificate available="true" corporationId="1005" discountAmount="0" canBeBidOn="YES">
				<FreeCertificate corporationId="1101" percentage="10"/>
			</Certificate>
		</Item>
		<Item row="6">
			<Certificate available="true" corporationId="1006" discountAmount="0" canBeBidOn="YES">
				<FreeCertificate corporationId="1102" percentage="20"/>
			</Certificate>
		</Item>
	</StartPacket>
</Corporations>